[
  {
    "name": "シュウ＝ウ一家",
    "leader": "オニオール＝ロンポウ",
    "ketsu_mochi": "第3王子チョウライ",
    "base_layer": "第4層",
    "purpose": "第4層の物流・流通を取り仕切り利益を得る。暗黒大陸での縄張り確保",
    "members": [
      {
        "name": "オニオール＝ロンポウ",
        "role": "組長",
        "nen_type": null,
        "ability": "詳細不明"
      },
      {
        "name": "ヒンリギ＝ビガンダフノ",
        "role": "若頭",
        "nen_type": "具現化系",
        "ability": "てのひらを太陽に（バイオハザード）：触れた機械・武器を元の機能を保ちながら生き物に変えて操作する"
      },
      {
        "name": "ザクロ＝カスタード",
        "role": "幹部",
        "nen_type": "操作系",
        "ability": "血いさな世界（ブラッディメアリー）：自分の血液を操る"
      },
      {
        "name": "リンチ＝フルボッコ",
        "role": "幹部",
        "nen_type": "放出系",
        "ability": "体は全部知っている（ボディアンドソウル）：殴った相手の体から情報を引き出す"
      }
    ],
    "note": "エイ＝イ一家（モレナ）に敵対。シャ＝ア一家と協力してモレナ討伐に動く。幻影旅団フィンクスと成り行きで共通の敵（モレナ）を持つ構図に"
  },
  {
    "name": "エイ＝イ一家",
    "leader": "モレナ＝プルード",
    "ketsu_mochi": "第4王子ツェリードニヒ",
    "base_layer": "不定（独自行動）",
    "purpose": "世界の破壊・秩序の崩壊。掟を破って組長に就任した異端者で、カキンマフィアの慣習を無視して独自の勢力拡大を図る",
    "members": [
      {
        "name": "モレナ＝プルード",
        "role": "組長",
        "nen_type": "特質系",
        "ability": "恋のエチュード（サイキンオセン）：唾液を通じて他者に念能力を発症させる感染型能力。一般人殺害で+1・念能力者で+10・王子で+50レベルアップ。最大23人まで感染拡大可能"
      },
      {
        "name": "ルイーニー",
        "role": "幹部（死亡）",
        "nen_type": "放出系",
        "ability": "扉のある壁に囲まれた個室内での空間移動能力。シャ＝ア一家のアジトに単独乗り込みノブナガに額を刀で刺されて死亡"
      }
    ],
    "note": "シュウ＝ウ一家・シャ＝ア一家両家から排除対象とみなされている。幻影旅団（ノブナガ等）も敵視。「うちら（旅団）に似ている」とノブナガに言及された"
  },
  {
    "name": "シャ＝ア一家",
    "leader": "ブロッコ＝リー",
    "ketsu_mochi": "第7王子ルズールス",
    "base_layer": "第5層",
    "purpose": "第5層の物資全般を管理・取り仕切る。暗黒大陸での縄張り確保",
    "members": [
      {
        "name": "ブロッコ＝リー",
        "role": "組長",
        "nen_type": null,
        "ability": "詳細不明。カキン国王ナスビーの腹違いの兄弟（二線者）"
      },
      {
        "name": "オウ＝ケンイ",
        "role": "若頭",
        "nen_type": "不明",
        "ability": "念能力者だが詳細不明。稀に「氷の微笑（スマイルゼロ）」と呼ばれる不気味な表情を見せる"
      },
      {
        "name": "イットク",
        "role": "副組長",
        "nen_type": null,
        "ability": "詳細不明"
      },
      {
        "name": "タハオ",
        "role": "組長補佐",
        "nen_type": null,
        "ability": "詳細不明"
      }
    ],
    "note": "シュウ＝ウ一家と共闘してモレナ討伐に動く。組長ブロッコは国王の腹違いの兄（二線者）。第384話ではタハオが組員8人と300人超の労働者の失踪を旅団へ説明し、ノブナガ・フィンクス・フェイタンとエイ＝イ一家への対処を協議する。約250名規模で武装"
  },
  {
    "name": "幻影旅団",
    "leader": "クロロ＝ルシルフル",
    "ketsu_mochi": "なし（独自行動）",
    "base_layer": "第3層",
    "purpose": "ヒソカの捜索・抹殺（イルミからの依頼）。クロロは暗黒大陸への独自の関心も持つ",
    "members": [
      {
        "name": "クロロ＝ルシルフル",
        "role": "団長",
        "nen_type": "特質系",
        "ability": "盗賊の極意（スキルハンター）：他者の念能力を盗んで使用できる。後に複数能力の同時発動が可能に進化"
      },
      {
        "name": "ノブナガ＝ハザマ",
        "role": "旅団員",
        "nen_type": "強化系",
        "ability": "エン（円）内に入った者を刀で斬ることができる。モレナを敵視して積極的に追跡"
      },
      {
        "name": "フィンクス＝マグカブ",
        "role": "旅団員",
        "nen_type": "強化系",
        "ability": "腕の回転によりパンチを強化する能力として登録されている。正式名称・条件は原作再照合待ち（旧記載の「デメンション（回転数）」は採用しない）",
        "ability_verification_status": "needs_original_review"
      },
      {
        "name": "フェイタン＝ポートオ",
        "role": "旅団員",
        "nen_type": "変化系",
        "ability": "ペインパッカー（苦痛の支配者）：受けたダメージを放出するか太陽放射に変えて敵に浴びせるかを選べる"
      }
    ],
    "note": "ブラックホエール第3層を拠点に活動。カキンマフィアとは組んでいないが、成り行きでシュウ＝ウ一家・シャ＝ア一家と共通の敵（モレナ）を持つ構図に。イルミ＝ゾルディックも別行動で乗船中"
  }
]
